### ISSUE TITLE
tcpdump: Missing egress traffic in some cases

### ISSUE THREAD

**Issue by mqasimsarfraz** [inspektor-gadget/inspektor-gadget#5022]
Currently when running tcpdump gadget, it seems we are missing some egress events e.g:

```bash
# Deploy Inspektor Gadget ( you need couple of nodes to reproduce this issue)
$ MINIKUBE_PARAMS='-n 2' make minikube-deploy 
# Start generating some HTTP requests in default namespace
$ kubectl apply -f https://gist.githubusercontent.com/mqasimsarfraz/a45c11007c7ca379ce99282450e7214d/raw/639b1fb7e5569cc7a95dbec522c4bf22d701b660/http-requests.yaml
# Start the tcpdump gadget
$ kubectl gadget run tcpdump -o pcap-ng --pf 'proto tcp' | tcpdump -nvr -
WARN[0000] version skew detected: client (v0.45.0) vs server (v0.45.0-100-g8e01147a9-dirty) 
reading from file -, link-type EN10MB (Ethernet), snapshot length 262144
01:00:00.000000 IP (tos 0x0, ttl 47, id 0, offset 0, flags [DF], proto TCP (6), length 60)
    23.192.228.80.80 > 10.244.1.6.45722: Flags [S.], cksum 0xca5d (correct), seq 4092089716, ack 2589605888, win 65160, options [mss 1460,sackOK,TS val 1625188231 ecr 3515090546,nop,wscale 7], length 0
01:00:00.000000 IP (tos 0x0, ttl 47, id 56678, offset 0, flags [DF], proto TCP (6), length 52)
    23.192.228.80.80 > 10.244.1.6.45722: Flags [.], cksum 0xf3bf (correct), ack 75, win 509, options [nop,nop,TS val 1625188444 ecr 3515090761], length 0
01:00:00.000000 IP (tos 0x0, ttl 47, id 56679, offset 0, flags [DF], proto TCP (6), length 827)
    23.192.228.80.80 > 10.244.1.6.45722: Flags [P.], cksum 0xbcbd (correct), seq 1:776, ack 75, win 509, options [nop,nop,TS val 1625188464 ecr 3515090761], length 775: HTTP, length: 775
	HTTP/1.1 200 OK
	Content-Type: text/html
	ETag: "bc2473a18e003bdb249eba5ce893033f:1760028122.592274"
	Last-Modified: Thu, 09 Oct 2025 16:42:02 GMT
	Cache-Control: max-age=86000
	Date: Wed, 29 Oct 2025 11:28:21 GMT
	Content-Length: 513
	Connection: keep-alive
	
	<!doctype html><html lang="en"><head><title>Example Domain</title><meta name="viewport" content="width=device-width, initial-scale=1"><style>body{background:#eee;width:60vw;margin:15vh auto;font-family:system-ui,sans-serif}h1{font-size:1.5em}div{opacity:0.8}a:link,a:visited{color:#348}</style><body><div><h1>Example Domain</h1><p>This domain is for use in documentation examples without needing permission. Avoid use in operations.<p><a href="https://iana.org/domains/example">Learn more</a></div></body></html>
01:00:00.000000 IP (tos 0x0, ttl 47, id 56680, offset 0, flags [DF], proto TCP (6), length 52)
    23.192.228.80.80 > 10.244.1.6.45722: Flags [F.], cksum 0xef17 (correct), seq 776, ack 76, win 509, options [nop,nop,TS val 1625188654 ecr 3515090966], length 0
01:00:00.000000 IP (tos 0x0, ttl 45, id 0, offset 0, flags [DF], proto TCP (6), length 60)
    23.215.0.138.80 > 10.244.1.6.56076: Flags [S.], cksum 0xa994 (correct), seq 1032063997, ack 329433446, win 65160, options [mss 1460,sackOK,TS val 3449985342 ecr 4277148607,nop,wscale 7], length 0
01:00:00.000000 IP (tos 0x0, ttl 45, id 0, offset 0, flags [DF], proto TCP (6), length 60)
    23.215.0.138.80 > 10.244.1.6.56076: Flags [S.], cksum 0xa926 (correct), seq 1032063997, ack 329433446, win 65160, options [mss 1460,sackOK,TS val 3449985452 ecr 4277148607,nop,wscale 7], length 0
01:00:00.000000 IP (tos 0x0, ttl 45, id 14218, offset 0, flags [DF], proto TCP (6), length 52)
    23.215.0.138.80 > 10.244.1.6.56076: Flags [.], cksum 0xd2fe (correct), ack 75, win 509, options [nop,nop,TS val 3449985551 ecr 4277148818], length 0
01:00:00.000000 IP (tos 0x0, ttl 45, id 0, offset 0, flags [DF], proto TCP (6), length 52)
    23.215.0.138.80 > 10.244.1.6.56076: Flags [.], cksum 0xd348 (correct), ack 1, win 509, options [nop,nop,TS val 3449985551 ecr 4277148818], length 0
01:00:00.000000 IP (tos 0x0, ttl 45, id 14219, offset 0, flags [DF], proto TCP (6), length 827)
    23.215.0.138.80 > 10.244.1.6.56076: Flags [P.], cksum 0x9701 (correct), seq 1:776, ack 75, win 509, options [nop,nop,TS val 3449985558 ecr 4277148826], length 775: HTTP, length: 775
	HTTP/1.1 200 OK
	Content-Type: text/html
	ETag: "bc2473a18e003bdb249eba5ce893033f:1760028122.592274"
	Last-Modified: Thu, 09 Oct 2025 16:42:02 GMT
	Cache-Control: max-age=86000
	Date: Wed, 29 Oct 2025 11:28:26 GMT
	Content-Length: 513
	Connection: keep-alive
	
	<!doctype html><html lang="en"><head><title>Example Domain</title><meta name="viewport" content="width=device-width, initial-scale=1"><style>body{background:#eee;width:60vw;margin:15vh auto;font-family:system-ui,sans-serif}h1{font-size:1.5em}div{opacity:0.8}a:link,a:visited{color:#348}</style><body><div><h1>Example Domain</h1><p>This domain is for use in documentation examples without needing permission. Avoid use in operations.<p><a href="https://iana.org/domains/example">Learn more</a></div></body></html>
01:00:00.000000 IP (tos 0x0, ttl 45, id 14220, offset 0, flags [DF], proto TCP (6), length 52)
    23.215.0.138.80 > 10.244.1.6.56076: Flags [F.], cksum 0xcf10 (correct), seq 776, ack 76, win 509, options [nop,nop,TS val 3449985666 ecr 4277148932], length 0
01:00:00.000000 IP (tos 0x0, ttl 44, id 0, offset 0, flags [DF], proto TCP (6), length 60)
    23.215.0.138.80 > 10.244.1.6.56092: Flags [S.], cksum 0xbf2c (correct), seq 58648321, ack 3670153713, win 65160, options [mss 1460,sackOK,TS val 3449990677 ecr 4277153942,nop,wscale 7], length 0
01:00:00.000000 IP (tos 0x0, ttl 44, id 41382, offset 0, flags [DF], proto TCP (6), length 52)
    23.215.0.138.80 > 10.244.1.6.56092: Flags [.], cksum 0xe95f (correct), ack 75, win 509, options [nop,nop,TS val 3449990786 ecr 4277154052], length 0
01:00:00.000000 IP (tos 0x0, ttl 44, id 41383, offset 0, flags [DF], proto TCP (6), length 827)
    23.215.0.138.80 > 10.244.1.6.56092: Flags [P.], cksum 0xb264 (correct), seq 1:776, ack 75, win 509, options [nop,nop,TS val 3449990798 ecr 4277154052], length 775: HTTP, length: 775
	HTTP/1.1 200 OK
	Content-Type: text/html
	ETag: "bc2473a18e003bdb249eba5ce893033f:1760028122.592274"
	Last-Modified: Thu, 09 Oct 2025 16:42:02 GMT
	Cache-Control: max-age=86000
	Date: Wed, 29 Oct 2025 11:28:31 GMT
	Content-Length: 513
	Connection: keep-alive
	
	<!doctype html><html lang="en"><head><title>Example Domain</title><meta name="viewport" content="width=device-width, initial-scale=1"><style>body{background:#eee;width:60vw;margin:15vh auto;font-family:system-ui,sans-serif}h1{font-size:1.5em}div{opacity:0.8}a:link,a:visited{color:#348}</style><body><div><h1>Example Domain</h1><p>This domain is for use in documentation examples without needing permission. Avoid use in operations.<p><a href="https://iana.org/domains/example">Learn more</a></div></body></html>
```

Also, I tried testing on AKS cluster and it seem to be having the same issue! 

cc: @flyth
